,nm_produto,ds_classe2,vl_total
0,Acem Moida DeliCia A/S Kg,Acougue,738.30
1,Acem S/O DeliCia A/S Peca Kg,Acougue,68.80
2,Acem S/O DeliCia A/S Pedaco Kg,Acougue,1467.20
3,Alcatra Com Maminha Peca Inteira Kg,Acougue,569.38
4,Alcatra Com Maminha Pedaco Kg,Acougue,4739.22
5,Alcatra Friboi Reserva Pedaco Resf.Kg,Acougue,13.60
6,Alcatra Pamplona Suina Temperada Kg,Acougue,30.93
7,Alcatra Porcionada Kg,Acougue,2448.41
8,Asa de Frango Big Fgo Resf.Bdj Kg,Acougue,44.84
9,Asa de Frango Big Fgo Resf.Kg,Acougue,10.26
10,Asa de Frango Copacol Resf.Kg,Acougue,98.62
11,Asa de Frango Maringa Resf.Kg,Acougue,72.97
12,Assado Campestre DeliCia A/S Kg,Acougue,24.78
13,Baby Beef DeliCia A/S Kg,Acougue,79.38
14,Bananinha Friboi do Contra File Kg,Acougue,99.57
15,Barriga Frimesa Suina C/P S/O Cong.Kg,Acougue,20.57
16,Barriga Suina Pamplona Temp.Resf.Kg,Acougue,12.04
17,Bife A Mineira DeliCia A/S Res.Espe.Kg,Acougue,6.15
18,Bife Alcatra DeliCia A/S Kg,Acougue,708.67
19,Bife Coxao Mole Kg,Acougue,170.54
20,Bife de Alcatra Com Maminha Kg,Acougue,10.52
21,Bife de Borboleta DeliCia A/S Kg,Acougue,76.15
22,Bife de Cacarola Friboi Reserva Kg,Acougue,55.90
23,Bife de Contra File DeliCia A/S Kg,Acougue,392.25
24,Bife de Contra File Kg,Acougue,22.93
25,Bife de Coxao Mole DeliCia A/S Kg,Acougue,2159.23
26,Bife de Maminha DeliCia A/S Kg,Acougue,53.70
27,Bife de Palha DeliCia S/A Kg,Acougue,25.52
28,Bife de Patinho DeliCia A/S Kg,Acougue,972.72
29,Bife de Picanha Friboi Reserva Kg,Acougue,15.74
30,Bife de Posta Branca DeliCia S/A Kg,Acougue,61.18
31,Bife Light DeliCia A/S Kg,Acougue,141.87
32,Bife Para Milanesa DeliCia A/S Kg,Acougue,53.75
33,Bife Para Role DeliCia A/S Kg,Acougue,23.62
34,Bife Paris DeliCia A/S Kg,Acougue,93.09
35,Bife Patinho Kg,Acougue,11.04
36,Bife Posta Vermelha DeliCia A/S Kg,Acougue,636.51
37,Bife Posta Vermelha Kg,Acougue,28.07
38,Bisteca Bizinelli Resf.Kg,Acougue,125.10
39,Bisteca da Paleta Friboi Cong.Kg,Acougue,38.67
40,Bisteca Fattoria Resf.Kg,Acougue,184.68
41,Bisteca Frimesa Fat.Cong.Kg,Acougue,745.64
42,Bisteca Suina Cong.Kg,Acougue,179.20
43,Bisteca Suina Resf.Kg,Acougue,11.08
44,Bisteca Tonini Resf.Kg,Acougue,143.34
45,Bombom do Alcatra DeliCia A/S Kg,Acougue,130.59
46,Brochete DeliCia A/S Kg,Acougue,49.38
47,Bucho Bovino Kg,Acougue,152.27
48,Carcaca Suina Fattoria Resf.Kg,Acougue,263.53
49,Carne Moida Copacol Frango Cong.500gr,Acougue,237.14
50,Carne Sete Com Osso Kg,Acougue,146.25
51,Contra File Com Osso Kg,Acougue,2381.14
52,Contra File Grill Friboi Reserva Kg,Acougue,17.81
53,Contra File Porcionado Kg,Acougue,2669.14
54,Contra File Sem Osso Peca Inteira Kg,Acougue,48.79
55,Contra File Sem Osso Pedaco Kg,Acougue,144.61
56,Copa Alegra Lombo Corte Facil Cong.K,Acougue,12.43
57,Coracao Bovino Kg,Acougue,14.28
58,Coracao de Frango Big Fgo Resf.Bdj Kg,Acougue,39.71
59,Coracao de Frango Big Fgo Resf.Kg,Acougue,7.95
60,Coracao de Frango Copacol Resf.Kg,Acougue,149.10
61,Coracao de Frango Maringa Resf.Kg,Acougue,12.02
62,Cortes Suinos Resf.Kg,Acougue,288.54
63,Costela  Alegra Suina Cong. Especial Kg,Acougue,23.66
64,Costela Ao Meio Suina Alegra Cong.Kg,Acougue,37.06
65,Costela Bovina Resf.Kg,Acougue,1580.26
66,Costela Suina Bizinelli Resf.Kg,Acougue,17.47
67,Costela Suina Fattoria Resf.Kg,Acougue,232.90
68,Costela Suina Frimesa Cong.Kg,Acougue,45.38
69,Costela Suina Pamplona Temp.Resf.Kg,Acougue,25.43
70,Costela Suina Tonini Resf.Kg,Acougue,62.00
71,Costelinha Copacol Frango Temp.Cong.1kg,Acougue,8.62
72,Coxa C/Sobrecoxa Big Fgo C/Pele Resf.Kg,Acougue,21.68
73,Coxa C/Sobrecoxa Big Fgo Resf.Bdj Kg,Acougue,58.16
74,Coxa C/Sobrecoxa C/Dorso Cong.Kg,Acougue,328.39
75,Coxa C/Sobrecoxa Frango Cong.Kg,Acougue,171.66
76,Coxa C/Sobrecoxa Frango Copacol Resf.Kg,Acougue,502.57
77,Coxa C/Sobrecoxa Frango Maringa Resf.Kg,Acougue,563.34
78,Coxa C/Sobrecoxa Seara Resf.Kg,Acougue,30.91
79,Coxa Frango Big Fgo Resf.Bdj Kg,Acougue,74.39
80,Coxa Frango Big Fgo Temp.Resf.Kg,Acougue,33.87
81,Coxa Frango Seara Resf.Kg,Acougue,18.78
82,Coxao Mole DeliCia A/S Pedaco Resf.Kg,Acougue,201.61
83,Coxao Mole Moido DeliCia A/S Kg,Acougue,3068.53
84,Coxao Mole Peca Inteira Kg,Acougue,438.06
85,Coxao Mole Pedaco Kg,Acougue,917.50
86,Coxao Mole Porcionado Kg,Acougue,4059.29
87,Coxinha da Asa Big Fgo Resf.Kg,Acougue,148.89
88,Coxinha da Asa Big Fgo Temp.Resf.Kg,Acougue,95.03
89,Coxinha da Asa Copacol Kg,Acougue,698.20
90,Coxinha da Asa Fgo Copacol Temp.Resf.1kg,Acougue,24.82
91,Coxinha da Asa Resf.Copacol Bdja 1kg,Acougue,50.12
92,Coxinha da Asa Resf.Maringa Kg,Acougue,140.91
93,Coxinha da Asa Seara Resf.Kg,Acougue,61.15
94,Cubos California DeliCia A/S Kg,Acougue,96.05
95,Cubos de Acem DeliCia A/S Kg,Acougue,5.46
96,Cubos de Paleta DeliCia A/S Kg,Acougue,50.89
97,Cubos P/Sopa DeliCia A/S Kg,Acougue,130.01
98,Dianteiro Bovino Kg,Acougue,1417.84
99,Drumette Big Fgo Resf.Bdj Kg,Acougue,113.93
100,Duckbeff de Patinho DeliCia A/S Kg,Acougue,137.94
101,Figado Bovino Kg,Acougue,106.16
102,Figado de Frango Copacol Resf.Kg,Acougue,40.11
103,File de Peito Big Fgo Resf.Kg,Acougue,77.91
104,File de Peito de Frango Cong.Kg,Acougue,2030.91
105,File de Sassami Big Fgo Resf.Bdj Kg,Acougue,220.13
106,File de Sassami Big Fgo Resf.Kg,Acougue,43.44
107,File Mignon Alegra Corte Facil Cong.Kg,Acougue,16.06
108,File Mignon Alegra Suino Temp.Resf.Kg,Acougue,37.34
109,File Mignon C/Cordao Kg,Acougue,16.01
110,File Mignon Friboi Porcionado Resf.Kg,Acougue,45.49
111,File Mignon Friboi Reserva Vac.Kg,Acougue,45.68
112,File Mignon Suino Alegra Cong.Kg,Acougue,29.89
113,File Peito Fgo Big Fgo Resf.Bdj Kg,Acougue,356.33
114,File Peito Fgo Copacol Temp.Resf.1kg,Acougue,24.14
115,File Peito Frango Big Fgo Temp.Resf.Kg,Acougue,34.19
116,File Peito Frango Copacol Resf.Kg,Acougue,1103.61
117,File Peito Frango Maringa Resf.Kg,Acougue,587.21
118,File Peito Frango Seara Resf.Kg,Acougue,133.48
119,Flanbeff de Patinho DeliCia A/S Kg,Acougue,90.31
120,Flatbeef Coxao Mole DeliCia A/S Kg,Acougue,26.62
121,Fraldinha Friboi Resf.Kg,Acougue,270.25
122,Fraldinha Grill do Chef Resf.Vacuo Kg,Acougue,49.02
123,Frango A Passarinho Big Fgo Resf.Bdj Kg,Acougue,64.97
124,Frango A Passarinho Big Fgo Resf.Kg,Acougue,13.45
125,Frango A Passarinho Big Fgo Temp.Resf.Kg,Acougue,7.21
126,Frango A Passarinho Copacol Resf.Kg,Acougue,62.57
127,Frango A Passarinho Copacol Temp.Resf.1k,Acougue,10.11
128,Frango Big Resf.Kg,Acougue,194.52
129,Frango Caipira Ivaipora Cortado Kg,Acougue,85.95
130,Frango Cong.Kg,Acougue,639.61
131,Frango Copacol Resf.Kg,Acougue,303.93
132,Frango Resfriado Maringa Kg,Acougue,526.63
133,Frango Sadia Assa Facil Temp.Cong.Kg,Acougue,66.09
134,Frango Seara Assa Facil Temp.Cong.Kg,Acougue,19.94
135,Galinha Fragnani Cong.Kg,Acougue,14.39
136,Galo do Sitio Cong.Kg,Acougue,37.27
137,Lingua Bovina Kg,Acougue,107.52
138,Linguica Alegra Pernil Cong.600g,Acougue,29.37
139,Linguica Alegra Pernil Resf.Kg,Acougue,119.40
140,Linguica Alegra Suina 600g C/Bacon,Acougue,11.68
141,Linguica Alegra Suina 600g C/Pimenta,Acougue,35.04
142,Linguica Alegra Suina 600g C/Queijo,Acougue,43.12
143,Linguica Alegra Suina Resf.Kg,Acougue,293.16
144,Linguica Alegra Toscana Resf.Kg,Acougue,41.20
145,Linguica Aurora Pernil Resf.Kg,Acougue,565.85
146,Linguica Bizinelli Fina Especial Kg,Acougue,354.08
147,Linguica Bizinelli Toscana Kg,Acougue,318.65
148,Linguica Copacol Churrasco Cong.1kg,Acougue,27.14
149,Linguica Copacol de Frango Cong.1kg,Acougue,150.18
150,Linguica Copacol de Frango Resf.1kg,Acougue,718.47
151,Linguica Fattoria Cheiro Verde Resf.Kg,Acougue,81.35
152,Linguica Fattoria Toscana Resf.Kg,Acougue,24.13
153,Linguica Frimesa Calab.Frescal Cong.1kg,Acougue,37.88
154,Linguica Frimesa Frango Fininha Cong.1kg,Acougue,73.55
155,Linguica Frimesa Pernil Suina Resf.1kg,Acougue,31.90
156,Linguica Frimesa Pernil Suina Resf.Kg,Acougue,42.57
157,Linguica Frimesa Pernil Suino Cong.1kg,Acougue,65.40
158,Linguica Frimesa Toscana Cong.1kg,Acougue,92.88
159,Linguica Frimesa Toscana Kg Cong.,Acougue,226.14
160,Linguica Frimesa Toscana Resf.Kg,Acougue,764.45
161,Linguica Frimesa Toscana Resf.Pct 1kg,Acougue,102.97
162,Linguica Lar Frango Fininha Resf.1kg,Acougue,113.58
163,Linguica Mista Suino Sabor Kg,Acougue,441.04
164,Linguica Perdigao Carne Suina Resf.700g,Acougue,98.68
165,Linguica Perdigao Pernil Na Brasacong.1g,Acougue,83.68
166,Linguica Perdigao Toscana 600g Alho/Erva,Acougue,53.71
167,Linguica Perdigao Toscana 600g C/Queijo,Acougue,15.46
168,Linguica Perdigao Toscana 600g Fgo/Bacon,Acougue,25.89
169,Linguica Perdigao Toscana Brasa Cong.1kg,Acougue,17.39
170,Linguica Sadia Toscana 950g,Acougue,58.48
171,Linguica Seara de Frango Cong.700g,Acougue,58.90
172,Linguica Tonini Pernil Resf.Kg,Acougue,48.91
173,Linguica Tonini Resf.Ervas Finas Kg,Acougue,205.14
174,Linguica Tonini Tc Kg,Acougue,265.08
175,Lombo Suino Alegra Cong.Kg,Acougue,25.19
176,Lombo Suino Alegra Temp.Resf.Kg,Acougue,89.22
177,Lombo Suino Fattoria Resf.Kg,Acougue,41.38
178,Maminha Friboi Reserva Peca Vac.Kg,Acougue,35.49
179,Medalhao do Alcatra Friboi Reserva Kg,Acougue,17.48
180,Meio da Asa Big Fgo Resf.Bdj  Kg,Acougue,92.63
181,Meio da Asa Big Fgo Temp.Resf.Kg,Acougue,114.06
182,Meio da Asa Copacol Kg,Acougue,264.15
183,Meio da Asa Seara Resf.Kg,Acougue,52.04
184,Miolo Alcatra DeliCia A/S Pedaco Kg,Acougue,20.79
185,Mocoto Bovino Kg,Acougue,9.02
186,Moela de Frango Big Fgo Resf.Kg,Acougue,77.93
187,Moela de Frango Copacol Resf.Kg,Acougue,76.32
188,Musculo Com Osso Kg,Acougue,6.88
189,Musculo DeliCia A/S Resf.Pedaco Kg,Acougue,88.67
190,Musculo Mole Friboi Reserva Tortug.Kg,Acougue,31.62
191,Musculo Picado DeliCia A/S Kg,Acougue,12.45
192,Paleta S/O DeliCia A/S Pedaco Kg,Acougue,338.32
193,Paleta Suina C/Osso C/Pele Resf.Kg,Acougue,19.42
194,Paleta Suina Fattoria C/Osso C/P Resf.Kg,Acougue,45.37
195,Patinho DeliCia A/S Pedaco Resf.Kg,Acougue,51.62
196,Patinho Friboi Reserva Peca Vac.Kg,Acougue,24.91
197,Patinho Moido DeliCia A/S Kg,Acougue,694.59
198,Patinho Peca Inteira Kg,Acougue,392.09
199,Patinho Pedaco Kg,Acougue,1497.37
200,Patinho Porcionado Resf.Kg,Acougue,455.05
201,Pe Suino Resf.Kg,Acougue,7.18
202,Peito de Frango Seara Resf.Kg,Acougue,4.59
203,Peito Frango Big Fgo C/O C/P Resf.Bdj Kg,Acougue,108.11
204,Peito Frango Big Fgo C/Osso C/P Resf.Kg,Acougue,47.96
205,Peito Frango C/Osso Cong.Kg,Acougue,233.00
206,Peito Frango C/Osso Maringa Resf.Kg,Acougue,353.73
207,Peito Frango Copacol Bdja 1kg,Acougue,43.88
208,Peito Frango Copacol Resf.Kg,Acougue,837.28
209,Peito Frango Copacol S/O S/P Bdja 1kg,Acougue,480.84
210,Peito Frango Copacol S/Pele  Bdja 1kg,Acougue,36.36
211,Peito Frango Copacol S/Pele Kg,Acougue,71.61
212,Peixinho Sanfonado DeliCia A/S Kg,Acougue,14.19
213,Pernil Prieto Suino Temp.Resf.Kg,Acougue,25.65
214,Pernil Suino C/Osso C/Pele Resf.Kg,Acougue,40.26
215,Pernil Suino Fattoria C/Osso C/P Resf.Kg,Acougue,232.16
216,Pernil Suino Pamplona C/O S/P Resf.Kg,Acougue,11.41
217,Pernil Suino Tonini C/O C/P Resf.Kg,Acougue,26.22
218,Petisco Copacol de Fgo Tem.Cong Pct 1kg,Acougue,32.01
219,Picanha Alegra Corte Facil Cong.Kg,Acougue,23.47
220,Picanha Anglo Fatiada Kg,Acougue,149.90
221,Picanha Anglo Friboi Resf.Kg,Acougue,49.04
222,Picanha Resf.Vacuo Kg,Acougue,56.89
223,Picanha Suina Alegra Temp.Resf.Kg,Acougue,125.20
224,Picanha Suina Frimesa Cong.Kg,Acougue,15.40
225,Picanha Suina Pamplona Temp.Resf.Kg,Acougue,16.31
226,Ponta de Costela Bovina Congelada Kg,Acougue,138.76
227,Ponta de Peito DeliCia A/S Pedaco Kg,Acougue,14.27
228,Posta Branca Friboi Porcionado Resf.Kg,Acougue,135.10
229,Posta Vermelha Peca Inteira Kg,Acougue,119.47
230,Posta Vermelha Pedaco Kg,Acougue,386.04
231,Posta Vermelha Porcionada Kg,Acougue,1145.64
232,Rabo Bovino Kg,Acougue,22.22
233,Recortes de Costela Suina Aurora Cong.Kg,Acougue,77.11
234,Redbeff DeliCia A/S Kg,Acougue,85.32
235,Sobrecoxa Big Fgo Resf.Bdj Kg,Acougue,111.07
236,Sobrecoxa Big Fgo Resf.Kg,Acougue,50.65
237,Sobrecoxa Frango Big Fgo Temp.Resf.Kg,Acougue,73.17
238,Sobrecoxa Frango Copacol S/Pele Bd 1kg,Acougue,146.24
239,Sobrecoxa Frango Copacol S/Pele Resf.Kg,Acougue,86.99
240,Sobrecoxa Frango Copacol Temp.Resf.1kg,Acougue,11.12
241,Sobrecoxa Seara Resf.Kg,Acougue,33.99
242,Sobrepaleta Suina Alegra Temp.Resf.Kg,Acougue,54.04
243,Sobrepaleta Suina Extra Alegra Cong.Kg,Acougue,46.71
244,Sobrepaleta Suina Pamplona Temp.Resf.Kg,Acougue,19.87
245,Stretto DeliCia A/S Kg,Acougue,79.61
246,Strogonoff Alcatra Friboi Reserva Kg,Acougue,71.32
247,Strogonoff Coxao Mole DeliCia A/S Kg,Acougue,264.28
248,Strogonoff Patinho Friboi Reserva Kg,Acougue,47.05
249,Toucinho Suino Fattoria C/Pele Resf.Kg,Acougue,5.59
250,Toucinho Suino Resf.Kg,Acougue,3.52
251,Toucinho Tonini Resf.Kg,Acougue,11.08
252,Agua Coco Ducoco 1l Tp,Bebidas Frias,69.65
253,Agua Coco Kero-Coco 1l Tp,Bebidas Frias,218.47
254,Agua Coco Kero-Coco 200ml Tp,Bebidas Frias,45.72
255,Agua Coco Obrigado 1l Tp,Bebidas Frias,713.48
256,Agua Coco Obrigado 200ml Tp,Bebidas Frias,4.98
257,Agua Coco Obrigado Abac./Pera 1l Tp,Bebidas Frias,12.98
258,Agua Coco Sococo 1l Tp,Bebidas Frias,305.04
259,Agua Coco Sococo 200ml  Tp,Bebidas Frias,57.61
260,Agua Coco Sococo 330ml Tp,Bebidas Frias,27.92
261,Agua Coco Trop Coco 1l,Bebidas Frias,791.85
262,Agua Crystal Sparkling Limao 310ml La,Bebidas Frias,7.48
263,Agua Crystal Sparkling Limao 510ml Pet,Bebidas Frias,28.26
264,Agua Crystal Sparkling Tang.310ml La,Bebidas Frias,11.79
265,Agua Crystal Sparkling Tang.510ml Pet,Bebidas Frias,14.61
266,Agua de Coco Mais Coco 1l Tp,Bebidas Frias,1079.04
267,Agua Min.Ama 500ml S/Gas Pet,Bebidas Frias,80.98
268,"Agua Min.Crystal 1,5l Pet",Bebidas Frias,70.78
269,Agua Min.Crystal 300ml Pet,Bebidas Frias,15.56
270,Agua Min.Crystal 310ml Copo,Bebidas Frias,5.79
271,Agua Min.Crystal 500ml Pet,Bebidas Frias,156.57
272,Agua Min.Crystal 5l,Bebidas Frias,140.86
273,"Agua Min.Crystal C/Gas 1,5l Pet",Bebidas Frias,32.45
274,Agua Min.Crystal C/Gas 500ml Pet,Bebidas Frias,118.71
275,Agua Min.Crystal Vip 350ml C./Gas Pet,Bebidas Frias,19.12
276,Agua Min.Crystal Vip 350ml Pet,Bebidas Frias,13.18
277,Agua Min.Font Life 10l Pet,Bebidas Frias,407.07
278,Agua Min.Font Life 5l Pet,Bebidas Frias,261.94
279,"Agua Min.Font Life C/Gas 1,5l Pet",Bebidas Frias,205.00
280,Agua Min.Font Life C/Gas 510ml Pet,Bebidas Frias,45.91
281,Agua Min.Font Life S/Gas 1.5l Pet,Bebidas Frias,89.48
282,Agua Min.Font Life S/Gas 510ml Pet,Bebidas Frias,99.18
283,Agua Min.Font Life Sport 510ml S/Gas Pet,Bebidas Frias,23.42
284,Agua Min.Maceratti 1.5l Pet,Bebidas Frias,7.60
285,Agua Min.Maceratti 300ml Copo,Bebidas Frias,7.62
286,Agua Min.Maceratti 502ml,Bebidas Frias,8.83
287,Agua Min.Maceratti 5l,Bebidas Frias,34.24
288,Agua Min.Maceratti C/Gas 2l Pet,Bebidas Frias,34.71
289,Agua Min.Maceratti C/Gas 505ml,Bebidas Frias,33.12
290,"Agua Min.Nestle Pureza Vital 1,5l Pet",Bebidas Frias,33.41
291,Agua Min.Nestle Pureza Vital 510ml Pet,Bebidas Frias,26.34
292,Agua Min.O Fino S/Gas 350ml Pet,Bebidas Frias,10.00
293,Agua Min.O.Fino 1.5l,Bebidas Frias,72.52
294,Agua Min.O.Fino 10l,Bebidas Frias,389.20
295,Agua Min.O.Fino 500ml Jr,Bebidas Frias,44.49
296,Agua Min.O.Fino 6l,Bebidas Frias,98.86
297,"Agua Min.O.Fino C/Gas 1,5l Pet",Bebidas Frias,57.60
298,Agua Min.O.Fino C/Gas 350ml Pet,Bebidas Frias,44.55
299,Agua Min.O.Fino C/Gas 500ml Pet,Bebidas Frias,49.17
300,Agua Min.Perrier C/Gas 330ml,Bebidas Frias,23.08
301,"Agua Min.Proteg 1,5 Pet",Bebidas Frias,72.10
302,Agua Min.Proteg 502ml Pet,Bebidas Frias,76.79
303,Agua Min.Proteg 5l Pet,Bebidas Frias,92.67
304,Agua Min.Proteg C/Gas 2l Pet,Bebidas Frias,32.85
305,Agua Min.Proteg C/Gas 505ml Pet,Bebidas Frias,31.14
306,Agua Min.Sao Lourenco C/Gas 1.260ml Pet,Bebidas Frias,7.56
307,Agua Min.Sao Lourenco C/Gas 300ml Pet,Bebidas Frias,9.76
308,"Agua Min.Schinc.C/Gas 1,5l",Bebidas Frias,22.87
309,Agua Min.Schinc.C/Gas 500ml Pet,Bebidas Frias,11.12
310,Agua Min.Schinc.S/Gas 500ml Pet,Bebidas Frias,56.76
311,Agua Min.Sferrie 1.5l C/Gas Pet,Bebidas Frias,14.65
312,Agua Min.Sferrie 1.5l Pet,Bebidas Frias,68.49
313,Agua Min.Sferrie 510ml C/Gas Pet,Bebidas Frias,68.06
314,Agua Min.Sferrie 510ml Pet,Bebidas Frias,34.49
315,Agua Min.Sferrie 5l,Bebidas Frias,63.49
316,Agua Min.Sferrie Premium C/Gas 410ml Pet,Bebidas Frias,7.05
317,Agua Min.Sferrie Premium S/Gas 410ml Pet,Bebidas Frias,13.16
318,Beb.Ades Soja Abac.1l Tp,Bebidas Frias,93.17
319,Beb.Ades Soja Abac.200ml Tp,Bebidas Frias,20.90
320,Beb.Ades Soja Lja 1l Tp,Bebidas Frias,59.18
321,Beb.Ades Soja Lja 200ml Tp,Bebidas Frias,34.72
322,Beb.Ades Soja Maca 1l Tp,Bebidas Frias,156.62
323,Beb.Ades Soja Maca 200ml Tp,Bebidas Frias,25.08
324,Beb.Ades Soja Mrgo 1l Tp,Bebidas Frias,78.00
325,Beb.Ades Soja Mrgo 200ml Tp,Bebidas Frias,18.27
326,Beb.Ades Soja Pess.1l Tp,Bebidas Frias,29.10
327,Beb.Ades Soja Uva 1l Tp,Bebidas Frias,58.66
328,Beb.Ades Soja Uva 200ml Tp,Bebidas Frias,24.54
329,Beb.Aquarius Fresh Limao 510ml Pet,Bebidas Frias,18.33
330,Beb.Cini Cristal Limao 600ml Pet,Bebidas Frias,31.16
331,Beb.Energ.Burn 1l Pet,Bebidas Frias,115.76
332,Beb.Energ.Burn 260ml,Bebidas Frias,5.39
333,Beb.Energ.Flying Horse 1l,Bebidas Frias,58.72
334,Beb.Energ.Furioso 2l,Bebidas Frias,314.61
335,Beb.Energ.Fusion 1l Pet,Bebidas Frias,64.82
336,Beb.Energ.Fusion Lja 310ml La,Bebidas Frias,13.27
337,Beb.Energ.Insano 1l,Bebidas Frias,116.64
338,Beb.Energ.Insano 269ml La,Bebidas Frias,13.14
339,Beb.Energ.Monster Assault 473ml La,Bebidas Frias,34.05
340,Beb.Energ.Monster Energy 473ml La,Bebidas Frias,206.40
341,Beb.Energ.Monster Khaos 473ml La,Bebidas Frias,225.27
342,Beb.Energ.Monster Lo-Carb 473ml La,Bebidas Frias,108.84
343,Beb.Energ.Monster Ultra 473ml La,Bebidas Frias,61.41
344,Beb.Energ.Red Bull 250ml La,Bebidas Frias,203.29
345,Beb.Energ.Red Bull 355ml La,Bebidas Frias,152.84
346,Beb.Energ.Red Bull 473ml La,Bebidas Frias,33.45
347,Beb.Energ.Red Bull Blue 250ml,Bebidas Frias,40.42
348,Beb.Energ.Red Bull Four Pack Lt,Bebidas Frias,26.02
349,Beb.Energ.Red Bull Red 250ml La,Bebidas Frias,59.38
350,Beb.Energ.Red Bull S.Free 250ml La,Bebidas Frias,103.77
351,Beb.Energ.Red Bull Summer/Tropical 250ml,Bebidas Frias,64.31
352,"Beb.H20h Citrus 1,5l Pet",Bebidas Frias,53.91
353,Beb.H20h Citrus 500ml Pet,Bebidas Frias,6.97
354,"Beb.H20h Limao 1,5l Pet",Bebidas Frias,131.78
355,Beb.H20h Limao 500ml Pet,Bebidas Frias,52.33
356,"Beb.H2oh Laranccini 1,5l Pet",Bebidas Frias,11.96
357,Beb.H2oh Laranccini 500ml Pet,Bebidas Frias,48.85
358,Beb.H2oh Limoneto 1.5l Pet,Bebidas Frias,71.86
359,Beb.H2oh Limoneto 500ml,Bebidas Frias,80.25
360,Beb.Hidrotonico I9 Lim.500ml Pet,Bebidas Frias,182.06
361,Beb.Hidrotonico I9 Mrcja 500ml Pet,Bebidas Frias,77.77
362,Beb.Hidrotonico I9 Tang.500ml Pet,Bebidas Frias,100.54
363,Beb.Hidrotonico I9 Uva Vde 500ml Pet,Bebidas Frias,133.16
364,Beb.Isot.Gatorade Ftas Citr.500ml Pet,Bebidas Frias,23.45
365,Beb.Isot.Gatorade Lim.1l,Bebidas Frias,104.85
366,Beb.Isot.Gatorade Lim.500ml Pet,Bebidas Frias,42.21
367,Beb.Isot.Gatorade Lja 500ml Pet,Bebidas Frias,9.38
368,Beb.Isot.Gatorade Mrcja 500ml Pet,Bebidas Frias,23.45
369,Beb.Isot.Gatorade Mrgo/Mrcja 500ml Pet,Bebidas Frias,70.35
370,Beb.Isot.Gatorade Tang.500ml Pet,Bebidas Frias,32.83
371,Beb.Isot.Gatorade Tangerina 1l,Bebidas Frias,34.95
372,Beb.Isot.Gatorade Uva 500ml Pet,Bebidas Frias,4.99
373,Beb.Isot.Powerade Lim.500ml Pet,Bebidas Frias,4.69
374,Beb.Isot.Powerade Mix Ftas 500ml Pet,Bebidas Frias,13.85
375,Beb.Isot.Powerade Uva 500ml Pet,Bebidas Frias,4.69
376,Beb.Purity Soja Abac.1l Tp,Bebidas Frias,10.23
377,Beb.Purity Soja Lja 1l Tp,Bebidas Frias,34.10
378,Beb.Purity Soja Maca 1l Tp,Bebidas Frias,30.69
379,Beb.Purity Soja Uva 1l Tp,Bebidas Frias,44.33
380,Beb.Sufresh Soja Lja 1l,Bebidas Frias,27.51
381,Beb.Sufresh Soja Maca 1l Tp,Bebidas Frias,52.53
382,Beb.Sufresh Soja Maca 200ml Tp,Bebidas Frias,9.96
383,Beb.Sufresh Soja Mrgo 1l Tp,Bebidas Frias,42.36
384,Beb.Sufresh Soja Uva 1l Tp,Bebidas Frias,15.15
385,Beb.Sufresh Soja Uva 200ml Tp,Bebidas Frias,7.38
386,Cerv.1500 Puro Malte 300ml Ow,Bebidas Frias,71.01
387,Cerv.1500 Puro Malte 350ml La,Bebidas Frias,392.20
388,Cerv.Ale Darguner Pilsner 330ml La,Bebidas Frias,11.52
389,Cerv.Ale.Darguner Pilsner 500ml La,Bebidas Frias,9.98
390,Cerv.Ale.Darguner Weissbier 500ml,Bebidas Frias,45.08
391,Cerv.Ale.Franziskaner Dunkel 500ml Ow,Bebidas Frias,35.38
392,Cerv.Ale.Franziskaner Hell 500ml Ow,Bebidas Frias,17.69
393,Cerv.Ale.Franziskaner Klar 500ml Ow,Bebidas Frias,35.96
394,Cerv.Antarc.Original 300ml Ow,Bebidas Frias,1235.93
395,Cerv.Antarc.Original 600ml Ow,Bebidas Frias,263.89
396,Cerv.Antarc.Pilsen 269ml La,Bebidas Frias,1141.76
397,Cerv.Antarc.Pilsen 350ml La,Bebidas Frias,69.72
398,Cerv.Antarc.Subzero 350ml La,Bebidas Frias,894.40
399,Cerv.Antarc.Subzero 473ml La,Bebidas Frias,12.84
400,Cerv.Arg.Quilmes 970ml Gf,Bebidas Frias,31.98
401,Cerv.Baden Baden 1999 600ml Ow,Bebidas Frias,15.12
402,Cerv.Baden Baden America Ipa 600ml Ow,Bebidas Frias,15.99
403,Cerv.Baden Baden Cristal 600ml Ow,Bebidas Frias,23.18
404,Cerv.Bavaria Pilsen 269ml La,Bebidas Frias,86.18
405,Cerv.Bavaria Pilsen 350ml La,Bebidas Frias,71.34
406,Cerv.Bavaria Pilsen 473ml,Bebidas Frias,246.98
407,Cerv.Bavaria Zero Alcool 350ml La,Bebidas Frias,21.93
408,Cerv.Belga Leffe Blond 330ml Ow,Bebidas Frias,35.94
409,Cerv.Bier Hoff American Wheat 355ml Ln,Bebidas Frias,4.99
410,Cerv.Bier Hoff Original 600ml,Bebidas Frias,10.90
411,Cerv.Bier Hoff Premium 600ml,Bebidas Frias,10.90
412,Cerv.Bier Hoff Red Ale 500ml Gf,Bebidas Frias,13.80
413,Cerv.Black Princess Gold 600ml Ow,Bebidas Frias,19.98
414,Cerv.Bohemia 14weiss 300ml Ow,Bebidas Frias,18.97
415,Cerv.Bohemia 350ml La,Bebidas Frias,471.05
416,Cerv.Bohemia 355ml Ln,Bebidas Frias,110.51
417,Cerv.Bohemia 838 Pale Ale 300ml Ow,Bebidas Frias,12.48
418,Cerv.Bohemia Aura Lager 300ml Ow,Bebidas Frias,12.48
419,Cerv.Brahma Chopp 300ml Gf-Rt,Bebidas Frias,495.58
420,Cerv.Brahma Chopp 300ml Ow,Bebidas Frias,36.27
421,Cerv.Brahma Chopp 350ml La,Bebidas Frias,3528.31
422,Cerv.Brahma Chopp 355ml Ln,Bebidas Frias,172.01
423,Cerv.Brahma Chopp Zero 300ml Gf-Rt,Bebidas Frias,42.96
424,Cerv.Brahma Chopp Zero Alcool 350ml La,Bebidas Frias,559.49
425,Cerv.Brahma Chopp Zero Alcool 355ml Ln,Bebidas Frias,82.94
426,Cerv.Brahma Extra Lager 350ml La,Bebidas Frias,420.51
427,Cerv.Brahma Extra Lager 355ml Ln,Bebidas Frias,380.41
428,Cerv.Brahma Extra Lager 600ml Ow,Bebidas Frias,66.69
429,Cerv.Brahma Extra Red Lager 355ml Ln,Bebidas Frias,212.89
430,Cerv.Brahma Extra Weiss 355ml Ln,Bebidas Frias,31.41
431,Cerv.Brahma Malzbier 350ml La,Bebidas Frias,373.77
432,Cerv.Brahma Malzbier 355ml Ln,Bebidas Frias,81.26
433,Cerv.Budweiser 343ml Ln,Bebidas Frias,383.13
434,Cerv.Budweiser 350ml La,Bebidas Frias,1695.84
435,Cerv.Budweiser 600ml Ow,Bebidas Frias,344.06
436,Cerv.Burguesa Pilsen 300ml Ow,Bebidas Frias,40.66
437,Cerv.Burguesa Pilsen 350ml La,Bebidas Frias,1307.31
438,Cerv.Caracu 350ml La,Bebidas Frias,24.43
439,Cerv.Caracu 355ml Ln,Bebidas Frias,18.35
440,Cerv.Colorado Appia 600ml,Bebidas Frias,14.90
441,Cerv.Colorado Demoiselle 600ml,Bebidas Frias,14.90
442,Cerv.Colorado Indica 600ml,Bebidas Frias,59.60
443,Cerv.Colorado Vixnu 600ml Ow,Bebidas Frias,17.92
444,Cerv.Corona Extra 355ml Ln,Bebidas Frias,95.84
445,Cerv.Coronita Extra 207ml Ln,Bebidas Frias,140.42
446,Cerv.Coruja Alba Weizen 500ml Ow,Bebidas Frias,25.38
447,Cerv.Coruja Noctua Dark 500ml Ow,Bebidas Frias,25.52
448,Cerv.Devassa Lager 350ml La,Bebidas Frias,60.66
449,Cerv.Devassa Loura 355ml Ln,Bebidas Frias,55.98
450,Cerv.Devassa Ruiva 355ml Ln,Bebidas Frias,37.01
451,Cerv.Dinam Faxe 10% 1l La,Bebidas Frias,39.80
452,Cerv.Dinam Faxe Witbier 1l La,Bebidas Frias,21.13
453,Cerv.Dom Bras Witbier 600ml Ow,Bebidas Frias,13.94
454,Cerv.Dom Pedro Munich Helles 600ml Ow,Bebidas Frias,13.01
455,Cerv.Dom Quixote Hefeweizen 600ml Ow,Bebidas Frias,13.94
456,Cerv.Eisenbahn 355ml Ln Ni5,Bebidas Frias,62.72
457,Cerv.Eisenbahn Dunkel 355ml Ln,Bebidas Frias,68.66
458,Cerv.Eisenbahn Kolsch 355ml Ln,Bebidas Frias,22.64
459,Cerv.Eisenbahn Pale 355ml Ln,Bebidas Frias,22.64
460,Cerv.Eisenbahn Pilsen 350ml La,Bebidas Frias,462.85
461,Cerv.Eisenbahn Pilsen 355ml Ln,Bebidas Frias,122.32
462,Cerv.Eisenbahn Pilsen 600ml Ow,Bebidas Frias,189.11
463,Cerv.Eisenbahn Strong 355ml Ln,Bebidas Frias,105.92
464,Cerv.Eisenbahn Weiss Bier 355ml Ln,Bebidas Frias,28.21
465,Cerv.Gauden Bier Pale Ale 600ml Ow,Bebidas Frias,14.90
466,Cerv.Germania 55 Pilsen 710ml La,Bebidas Frias,412.05
467,Cerv.Glacial Pilsen 350ml La,Bebidas Frias,88.82
468,Cerv.Heineken 250ml Ln,Bebidas Frias,9.57
469,Cerv.Heineken 330ml Ln,Bebidas Frias,525.84
470,Cerv.Heineken 350ml La,Bebidas Frias,712.25
471,Cerv.Heineken 600ml Ow,Bebidas Frias,94.61
472,Cerv.Hoegaarden White 330ml Ow,Bebidas Frias,7.48
473,Cerv.Ita.Birra Moretti 330ml Ln,Bebidas Frias,17.98
474,Cerv.Itaipava Malzbier 350ml La,Bebidas Frias,139.94
475,Cerv.Itaipava Malzbier 355ml Ln,Bebidas Frias,59.94
476,Cerv.Itaipava Pilsen 250ml Ln,Bebidas Frias,215.33
477,Cerv.Itaipava Pilsen 269ml La,Bebidas Frias,96.63
478,Cerv.Itaipava Pilsen 350ml La,Bebidas Frias,850.01
479,Cerv.Itaipava Pilsen 473ml La,Bebidas Frias,258.20
480,Cerv.Itaipava Premium 350ml,Bebidas Frias,92.57
481,Cerv.Itaipava Premium 355ml Ln,Bebidas Frias,94.49
482,Cerv.Itaipava Premium 600ml Ow,Bebidas Frias,90.84
483,Cerv.Itaipava Zero Alcool 350ml La,Bebidas Frias,49.44
484,Cerv.Kaiser Pilsen 269ml La,Bebidas Frias,33.40
485,Cerv.Kaiser Pilsen 350ml La,Bebidas Frias,814.17
486,Cerv.Kaiser Pilsen 473ml,Bebidas Frias,332.85
487,Cerv.Kaiser Shot Pilsen 250ml,Bebidas Frias,27.04
488,Cerv.Opa Bier Ipa 600ml Ow,Bebidas Frias,11.09
489,Cerv.Opa Bier Merecida 600ml Ow,Bebidas Frias,15.14
490,Cerv.Opa Bier Pilsen 600ml Ow,Bebidas Frias,15.90
491,Cerv.Opa Bier Weizen 600ml Ow,Bebidas Frias,8.67
492,Cerv.Patagonia Amber Lager 740ml,Bebidas Frias,50.94
493,Cerv.Patagonia Boheimian 740ml,Bebidas Frias,50.94
494,Cerv.Patagonia Weisse 740ml,Bebidas Frias,222.54
495,Cerv.Petra Aurum 500ml Gf,Bebidas Frias,27.80
496,Cerv.Petra Premium 355ml Ln,Bebidas Frias,69.09
497,Cerv.Providencia Premium Dunkel 500ml,Bebidas Frias,14.77
